{
  "schema": "linking_graph/1",
  "generated_by": "8672b2d",
  "params": {"prime_bound": 500, "n_primes": 44, "graph_nodes": 40, "edge_rule": "linked pairs: (p_i/p_j) = -1"},
  "nodes": [{"id": 0, "prime": 5, "degree": 24},{"id": 1, "prime": 13, "degree": 25},{"id": 2, "prime": 17, "degree": 23},{"id": 3, "prime": 29, "degree": 23},{"id": 4, "prime": 37, "degree": 23},{"id": 5, "prime": 41, "degree": 23},{"id": 6, "prime": 53, "degree": 24},{"id": 7, "prime": 61, "degree": 24},{"id": 8, "prime": 73, "degree": 21},{"id": 9, "prime": 89, "degree": 25},{"id": 10, "prime": 97, "degree": 23},{"id": 11, "prime": 101, "degree": 26},{"id": 12, "prime": 109, "degree": 19},{"id": 13, "prime": 113, "degree": 22},{"id": 14, "prime": 137, "degree": 21},{"id": 15, "prime": 149, "degree": 26},{"id": 16, "prime": 157, "degree": 22},{"id": 17, "prime": 173, "degree": 21},{"id": 18, "prime": 181, "degree": 19},{"id": 19, "prime": 193, "degree": 25},{"id": 20, "prime": 197, "degree": 20},{"id": 21, "prime": 229, "degree": 19},{"id": 22, "prime": 233, "degree": 23},{"id": 23, "prime": 241, "degree": 22},{"id": 24, "prime": 257, "degree": 22},{"id": 25, "prime": 269, "degree": 22},{"id": 26, "prime": 277, "degree": 25},{"id": 27, "prime": 281, "degree": 22},{"id": 28, "prime": 293, "degree": 20},{"id": 29, "prime": 313, "degree": 22},{"id": 30, "prime": 317, "degree": 22},{"id": 31, "prime": 337, "degree": 20},{"id": 32, "prime": 349, "degree": 21},{"id": 33, "prime": 353, "degree": 21},{"id": 34, "prime": 373, "degree": 23},{"id": 35, "prime": 389, "degree": 21},{"id": 36, "prime": 397, "degree": 26},{"id": 37, "prime": 401, "degree": 21},{"id": 38, "prime": 409, "degree": 19},{"id": 39, "prime": 421, "degree": 20}],
  "edges": [{"source": 0, "target": 1},{"source": 0, "target": 2},{"source": 0, "target": 4},{"source": 0, "target": 6},{"source": 0, "target": 8},{"source": 0, "target": 10},{"source": 0, "target": 13},{"source": 0, "target": 14},{"source": 0, "target": 16},{"source": 0, "target": 17},{"source": 0, "target": 19},{"source": 0, "target": 20},{"source": 0, "target": 22},{"source": 0, "target": 24},{"source": 0, "target": 26},{"source": 0, "target": 28},{"source": 0, "target": 29},{"source": 0, "target": 30},{"source": 0, "target": 31},{"source": 0, "target": 33},{"source": 0, "target": 34},{"source": 0, "target": 36},{"source": 1, "target": 4},{"source": 1, "target": 5},{"source": 1, "target": 8},{"source": 1, "target": 9},{"source": 1, "target": 10},{"source": 1, "target": 12},{"source": 1, "target": 14},{"source": 1, "target": 15},{"source": 1, "target": 19},{"source": 1, "target": 20},{"source": 1, "target": 21},{"source": 1, "target": 23},{"source": 1, "target": 27},{"source": 1, "target": 28},{"source": 1, "target": 30},{"source": 1, "target": 32},{"source": 1, "target": 33},{"source": 1, "target": 36},{"source": 1, "target": 37},{"source": 1, "target": 38},{"source": 1, "target": 39},{"source": 2, "target": 3},{"source": 2, "target": 4},{"source": 2, "target": 5},{"source": 2, "target": 7},{"source": 2, "target": 8},{"source": 2, "target": 10},{"source": 2, "target": 12},{"source": 2, "target": 13},{"source": 2, "target": 17},{"source": 2, "target": 18},{"source": 2, "target": 19},{"source": 2, "target": 20},{"source": 2, "target": 22},{"source": 2, "target": 23},{"source": 2, "target": 25},{"source": 2, "target": 26},{"source": 2, "target": 29},{"source": 2, "target": 30},{"source": 2, "target": 31},{"source": 2, "target": 36},{"source": 2, "target": 37},{"source": 3, "target": 4},{"source": 3, "target": 5},{"source": 3, "target": 7},{"source": 3, "target": 8},{"source": 3, "target": 9},{"source": 3, "target": 10},{"source": 3, "target": 11},{"source": 3, "target": 13},{"source": 3, "target": 14},{"source": 3, "target": 16},{"source": 3, "target": 19},{"source": 3, "target": 21},{"source": 3, "target": 25},{"source": 3, "target": 28},{"source": 3, "target": 30},{"source": 3, "target": 31},{"source": 3, "target": 35},{"source": 3, "target": 38},{"source": 3, "target": 39},{"source": 4, "target": 7},{"source": 4, "target": 9},{"source": 4, "target": 10},{"source": 4, "target": 12},{"source": 4, "target": 13},{"source": 4, "target": 19},{"source": 4, "target": 23},{"source": 4, "target": 24},{"source": 4, "target": 26},{"source": 4, "target": 27},{"source": 4, "target": 29},{"source": 4, "target": 33},{"source": 4, "target": 35},{"source": 4, "target": 37},{"source": 4, "target": 38},{"source": 4, "target": 39},{"source": 5, "target": 6},{"source": 5, "target": 9},{"source": 5, "target": 10},{"source": 5, "target": 11},{"source": 5, "target": 12},{"source": 5, "target": 14},{"source": 5, "target": 15},{"source": 5, "target": 16},{"source": 5, "target": 18},{"source": 5, "target": 19},{"source": 5, "target": 21},{"source": 5, "target": 22},{"source": 5, "target": 24},{"source": 5, "target": 27},{"source": 5, "target": 28},{"source": 5, "target": 29},{"source": 5, "target": 30},{"source": 5, "target": 36},{"source": 5, "target": 39},{"source": 6, "target": 7},{"source": 6, "target": 8},{"source": 6, "target": 11},{"source": 6, "target": 12},{"source": 6, "target": 14},{"source": 6, "target": 16},{"source": 6, "target": 17},{"source": 6, "target": 18},{"source": 6, "target": 19},{"source": 6, "target": 22},{"source": 6, "target": 24},{"source": 6, "target": 26},{"source": 6, "target": 29},{"source": 6, "target": 31},{"source": 6, "target": 32},{"source": 6, "target": 33},{"source": 6, "target": 34},{"source": 6, "target": 35},{"source": 6, "target": 36},{"source": 6, "target": 37},{"source": 6, "target": 39},{"source": 7, "target": 9},{"source": 7, "target": 11},{"source": 7, "target": 16},{"source": 7, "target": 17},{"source": 7, "target": 18},{"source": 7, "target": 19},{"source": 7, "target": 22},{"source": 7, "target": 26},{"source": 7, "target": 27},{"source": 7, "target": 29},{"source": 7, "target": 31},{"source": 7, "target": 32},{"source": 7, "target": 34},{"source": 7, "target": 35},{"source": 7, "target": 36},{"source": 7, "target": 37},{"source": 7, "target": 38},{"source": 7, "target": 39},{"source": 8, "target": 11},{"source": 8, "target": 13},{"source": 8, "target": 16},{"source": 8, "target": 19},{"source": 8, "target": 20},{"source": 8, "target": 21},{"source": 8, "target": 22},{"source": 8, "target": 23},{"source": 8, "target": 26},{"source": 8, "target": 27},{"source": 8, "target": 29},{"source": 8, "target": 31},{"source": 8, "target": 38},{"source": 8, "target": 39},{"source": 9, "target": 11},{"source": 9, "target": 13},{"source": 9, "target": 14},{"source": 9, "target": 15},{"source": 9, "target": 18},{"source": 9, "target": 19},{"source": 9, "target": 20},{"source": 9, "target": 21},{"source": 9, "target": 23},{"source": 9, "target": 27},{"source": 9, "target": 28},{"source": 9, "target": 29},{"source": 9, "target": 31},{"source": 9, "target": 32},{"source": 9, "target": 33},{"source": 9, "target": 35},{"source": 9, "target": 36},{"source": 9, "target": 39},{"source": 10, "target": 14},{"source": 10, "target": 15},{"source": 10, "target": 16},{"source": 10, "target": 17},{"source": 10, "target": 18},{"source": 10, "target": 22},{"source": 10, "target": 24},{"source": 10, "target": 26},{"source": 10, "target": 27},{"source": 10, "target": 30},{"source": 10, "target": 31},{"source": 10, "target": 32},{"source": 10, "target": 34},{"source": 10, "target": 37},{"source": 10, "target": 38},{"source": 11, "target": 12},{"source": 11, "target": 13},{"source": 11, "target": 15},{"source": 11, "target": 17},{"source": 11, "target": 21},{"source": 11, "target": 23},{"source": 11, "target": 24},{"source": 11, "target": 25},{"source": 11, "target": 26},{"source": 11, "target": 28},{"source": 11, "target": 29},{"source": 11, "target": 31},{"source": 11, "target": 32},{"source": 11, "target": 33},{"source": 11, "target": 35},{"source": 11, "target": 36},{"source": 11, "target": 37},{"source": 12, "target": 15},{"source": 12, "target": 18},{"source": 12, "target": 21},{"source": 12, "target": 23},{"source": 12, "target": 24},{"source": 12, "target": 25},{"source": 12, "target": 26},{"source": 12, "target": 29},{"source": 12, "target": 30},{"source": 12, "target": 31},{"source": 12, "target": 35},{"source": 12, "target": 36},{"source": 13, "target": 14},{"source": 13, "target": 18},{"source": 13, "target": 19},{"source": 13, "target": 20},{"source": 13, "target": 21},{"source": 13, "target": 25},{"source": 13, "target": 27},{"source": 13, "target": 28},{"source": 13, "target": 32},{"source": 13, "target": 34},{"source": 13, "target": 36},{"source": 13, "target": 38},{"source": 14, "target": 15},{"source": 14, "target": 16},{"source": 14, "target": 21},{"source": 14, "target": 22},{"source": 14, "target": 23},{"source": 14, "target": 25},{"source": 14, "target": 26},{"source": 14, "target": 30},{"source": 14, "target": 32},{"source": 14, "target": 33},{"source": 14, "target": 37},{"source": 14, "target": 39},{"source": 15, "target": 16},{"source": 15, "target": 18},{"source": 15, "target": 19},{"source": 15, "target": 20},{"source": 15, "target": 22},{"source": 15, "target": 23},{"source": 15, "target": 24},{"source": 15, "target": 26},{"source": 15, "target": 29},{"source": 15, "target": 32},{"source": 15, "target": 33},{"source": 15, "target": 34},{"source": 15, "target": 35},{"source": 15, "target": 36},{"source": 15, "target": 38},{"source": 16, "target": 18},{"source": 16, "target": 21},{"source": 16, "target": 23},{"source": 16, "target": 25},{"source": 16, "target": 28},{"source": 16, "target": 31},{"source": 16, "target": 34},{"source": 16, "target": 36},{"source": 16, "target": 37},{"source": 16, "target": 38},{"source": 16, "target": 39},{"source": 17, "target": 18},{"source": 17, "target": 19},{"source": 17, "target": 23},{"source": 17, "target": 26},{"source": 17, "target": 27},{"source": 17, "target": 28},{"source": 17, "target": 32},{"source": 17, "target": 33},{"source": 17, "target": 34},{"sourc